{
  "days": [
    {
      "vietnam_date": "01/01/2021",
      "lunar_date": "18/11",
      "tidal_data": [
        {
          "height": -0.57,
          "time": "2021-01-01T06:02:00+07:00",
          "type": "low"
        },
        {
          "height": 0.16,
          "time": "2021-01-01T14:00:00+07:00",
          "type": "high"
        },
        {
          "height": 0.14,
          "time": "2021-01-01T16:14:00+07:00",
          "type": "low"
        },
        {
          "height": 0.39,
          "time": "2021-01-01T22:35:00+07:00",
          "type": "high"
        }
      ],
      "pressure_data": [
        {
          "time": "2021-01-01T09:00:00+07:00",
          "pressure": 1021.24
        },
        {
          "time": "2021-01-01T10:00:00+07:00",
          "pressure": 1021.69
        },
        {
          "time": "2021-01-01T11:00:00+07:00",
          "pressure": 1020.9
        },
        {
          "time": "2021-01-01T12:00:00+07:00",
          "pressure": 1020.12
        },
        {
          "time": "2021-01-01T13:00:00+07:00",
          "pressure": 1019.34
        },
        {
          "time": "2021-01-01T14:00:00+07:00",
          "pressure": 1018.88
        },
        {
          "time": "2021-01-01T15:00:00+07:00",
          "pressure": 1018.42
        },
        {
          "time": "2021-01-01T16:00:00+07:00",
          "pressure": 1017.96
        }
      ],
      "fish_caught": NaN,
      "user_score": NaN,
      "user_notes": NaN
    },
    {
      "vietnam_date": "02/01/2021",
      "lunar_date": "19/11",
      "tidal_data": [
        {
          "height": -0.56,
          "time": "2021-01-02T06:40:00+07:00",
          "type": "low"
        },
        {
          "height": 0.17,
          "time": "2021-01-02T14:38:00+07:00",
          "type": "high"
        },
        {
          "height": 0.14,
          "time": "2021-01-02T17:07:00+07:00",
          "type": "low"
        },
        {
          "height": 0.37,
          "time": "2021-01-02T23:19:00+07:00",
          "type": "high"
        }
      ],
      "pressure_data": [
        {
          "time": "2021-01-02T09:00:00+07:00",
          "pressure": 1019.81
        },
        {
          "time": "2021-01-02T10:00:00+07:00",
          "pressure": 1020.01
        },
        {
          "time": "2021-01-02T11:00:00+07:00",
          "pressure": 1019.07
        },
        {
          "time": "2021-01-02T12:00:00+07:00",
          "pressure": 1018.13
        },
        {
          "time": "2021-01-02T13:00:00+07:00",
          "pressure": 1017.18
        },
        {
          "time": "2021-01-02T14:00:00+07:00",
          "pressure": 1016.71
        },
        {
          "time": "2021-01-02T15:00:00+07:00",
          "pressure": 1016.23
        },
        {
          "time": "2021-01-02T16:00:00+07:00",
          "pressure": 1015.76
        }
      ],
      "fish_caught": NaN,
      "user_score": NaN,
      "user_notes": NaN
    },
    {
      "vietnam_date": "03/01/2021",
      "lunar_date": "20/11",
      "tidal_data": [
        {
          "height": -0.53,
          "time": "2021-01-03T07:21:00+07:00",
          "type": "low"
        },
        {
          "height": 0.17,
          "time": "2021-01-03T15:11:00+07:00",
          "type": "high"
        },
        {
          "height": 0.12,
          "time": "2021-01-03T18:14:00+07:00",
          "type": "low"
        }
      ],
      "pressure_data": [
        {
          "time": "2021-01-03T09:00:00+07:00",
          "pressure": 1018.56
        },
        {
          "time": "2021-01-03T10:00:00+07:00",
          "pressure": 1018.84
        },
        {
          "time": "2021-01-03T11:00:00+07:00",
          "pressure": 1018.18
        },
        {
          "time": "2021-01-03T12:00:00+07:00",
          "pressure": 1017.51
        },
        {
          "time": "2021-01-03T13:00:00+07:00",
          "pressure": 1016.84
        },
        {
          "time": "2021-01-03T14:00:00+07:00",
          "pressure": 1016.28
        },
        {
          "time": "2021-01-03T15:00:00+07:00",
          "pressure": 1015.71
        },
        {
          "time": "2021-01-03T16:00:00+07:00",
          "pressure": 1015.15
        }
      ],
      "fish_caught": NaN,
      "user_score": NaN,
      "user_notes": NaN
    },
    {
      "vietnam_date": "04/01/2021",
      "lunar_date": "21/11",
      "tidal_data": [
        {
          "height": 0.34,
          "time": "2021-01-04T00:12:00+07:00",
          "type": "high"
        },
        {
          "height": -0.47,
          "time": "2021-01-04T08:04:00+07:00",
          "type": "low"
        },
        {
          "height": 0.18,
          "time": "2021-01-04T15:43:00+07:00",
          "type": "high"
        },
        {
          "height": 0.09,
          "time": "2021-01-04T19:37:00+07:00",
          "type": "low"
        }
      ],
      "pressure_data": [
        {
          "time": "2021-01-04T09:00:00+07:00",
          "pressure": 1018.55
        },
        {
          "time": "2021-01-04T10:00:00+07:00",
          "pressure": 1018.94
        },
        {
          "time": "2021-01-04T11:00:00+07:00",
          "pressure": 1017.91
        },
        {
          "time": "2021-01-04T12:00:00+07:00",
          "pressure": 1016.88
        },
        {
          "time": "2021-01-04T13:00:00+07:00",
          "pressure": 1015.84
        },
        {
          "time": "2021-01-04T14:00:00+07:00",
          "pressure": 1015.51
        },
        {
          "time": "2021-01-04T15:00:00+07:00",
          "pressure": 1015.17
        },
        {
          "time": "2021-01-04T16:00:00+07:00",
          "pressure": 1014.83
        }
      ],
      "fish_caught": NaN,
      "user_score": NaN,
      "user_notes": NaN
    },
    {
      "vietnam_date": "05/01/2021",
      "lunar_date": "22/11",
      "tidal_data": [
        {
          "height": 0.28,
          "time": "2021-01-05T01:16:00+07:00",
          "type": "high"
        },
        {
          "height": -0.4,
          "time": "2021-01-05T08:49:00+07:00",
          "type": "low"
        },
        {
          "height": 0.2,
          "time": "2021-01-05T16:15:00+07:00",
          "type": "high"
        },
        {
          "height": 0.03,
          "time": "2021-01-05T21:11:00+07:00",
          "type": "low"
        }
      ],
      "pressure_data": [
        {
          "time": "2021-01-05T09:00:00+07:00",
          "pressure": 1017.82
        },
        {
          "time": "2021-01-05T10:00:00+07:00",
          "pressure": 1018.28
        },
        {
          "time": "2021-01-05T11:00:00+07:00",
          "pressure": 1017.44
        },
        {
          "time": "2021-01-05T12:00:00+07:00",
          "pressure": 1016.59
        },
        {
          "time": "2021-01-05T13:00:00+07:00",
          "pressure": 1015.74
        },
        {
          "time": "2021-01-05T14:00:00+07:00",
          "pressure": 1015.43
        },
        {
          "time": "2021-01-05T15:00:00+07:00",
          "pressure": 1015.13
        },
        {
          "time": "2021-01-05T16:00:00+07:00",
          "pressure": 1014.82
        }
      ],
      "fish_caught": NaN,
      "user_score": NaN,
      "user_notes": NaN
    },
    {
      "vietnam_date": "06/01/2021",
      "lunar_date": "23/11",
      "tidal_data": [
        {
          "height": 0.21,
          "time": "2021-01-06T02:37:00+07:00",
          "type": "high"
        },
        {
          "height": -0.31,
          "time": "2021-01-06T09:37:00+07:00",
          "type": "low"
        },
        {
          "height": 0.23,
          "time": "2021-01-06T16:50:00+07:00",
          "type": "high"
        },
        {
          "height": -0.06,
          "time": "2021-01-06T22:44:00+07:00",
          "type": "low"
        }
      ],
      "pressure_data": [
        {
          "time": "2021-01-06T09:00:00+07:00",
          "pressure": 1017.65
        },
        {
          "time": "2021-01-06T10:00:00+07:00",
          "pressure": 1018.01
        },
        {
          "time": "2021-01-06T11:00:00+07:00",
          "pressure": 1016.8
        },
        {
          "time": "2021-01-06T12:00:00+07:00",
          "pressure": 1015.6
        },
        {
          "time": "2021-01-06T13:00:00+07:00",
          "pressure": 1014.39
        },
        {
          "time": "2021-01-06T14:00:00+07:00",
          "pressure": 1013.87
        },
        {
          "time": "2021-01-06T15:00:00+07:00",
          "pressure": 1013.36
        },
        {
          "time": "2021-01-06T16:00:00+07:00",
          "pressure": 1012.84
        }
      ],
      "fish_caught": NaN,
      "user_score": NaN,
      "user_notes": NaN
    },
    {
      "vietnam_date": "07/01/2021",
      "lunar_date": "24/11",
      "tidal_data": [
        {
          "height": 0.14,
          "time": "2021-01-07T04:16:00+07:00",
          "type": "high"
        },
        {
          "height": -0.22,
          "time": "2021-01-07T10:27:00+07:00",
          "type": "low"
        },
        {
          "height": 0.27,
          "time": "2021-01-07T17:27:00+07:00",
          "type": "high"
        }
      ],
      "pressure_data": [
        {
          "time": "2021-01-07T09:00:00+07:00",
          "pressure": 1016.19
        },
        {
          "time": "2021-01-07T10:00:00+07:00",
          "pressure": 1016.44
        },
        {
          "time": "2021-01-07T11:00:00+07:00",
          "pressure": 1015.58
        },
        {
          "time": "2021-01-07T12:00:00+07:00",
          "pressure": 1014.73
        },
        {
          "time": "2021-01-07T13:00:00+07:00",
          "pressure": 1013.87
        },
        {
          "time": "2021-01-07T14:00:00+07:00",
          "pressure": 1013.35
        },
        {
          "time": "2021-01-07T15:00:00+07:00",
          "pressure": 1012.83
        },
        {
          "time": "2021-01-07T16:00:00+07:00",
          "pressure": 1012.31
        }
      ],
      "fish_caught": NaN,
      "user_score": NaN,
      "user_notes": NaN
    },
    {
      "vietnam_date": "08/01/2021",
      "lunar_date": "25/11",
      "tidal_data": [
        {
          "height": -0.17,
          "time": "2021-01-08T00:06:00+07:00",
          "type": "low"
        },
        {
          "height": 0.11,
          "time": "2021-01-08T06:02:00+07:00",
          "type": "high"
        },
        {
          "height": -0.13,
          "time": "2021-01-08T11:19:00+07:00",
          "type": "low"
        },
        {
          "height": 0.32,
          "time": "2021-01-08T18:07:00+07:00",
          "type": "high"
        }
      ],
      "pressure_data": [
        {
          "time": "2021-01-08T09:00:00+07:00",
          "pressure": 1017.56
        },
        {
          "time": "2021-01-08T10:00:00+07:00",
          "pressure": 1018.17
        },
        {
          "time": "2021-01-08T11:00:00+07:00",
          "pressure": 1017.76
        },
        {
          "time": "2021-01-08T12:00:00+07:00",
          "pressure": 1017.35
        },
        {
          "time": "2021-01-08T13:00:00+07:00",
          "pressure": 1016.93
        },
        {
          "time": "2021-01-08T14:00:00+07:00",
          "pressure": 1016.61
        },
        {
          "time": "2021-01-08T15:00:00+07:00",
          "pressure": 1016.29
        },
        {
          "time": "2021-01-08T16:00:00+07:00",
          "pressure": 1015.96
        }
      ],
      "fish_caught": NaN,
      "user_score": NaN,
      "user_notes": NaN
    },
    {
      "vietnam_date": "09/01/2021",
      "lunar_date": "26/11",
      "tidal_data": [
        {
          "height": -0.29,
          "time": "2021-01-09T01:15:00+07:00",
          "type": "low"
        },
        {
          "height": 0.11,
          "time": "2021-01-09T07:39:00+07:00",
          "type": "high"
        },
        {
          "height": -0.06,
          "time": "2021-01-09T12:11:00+07:00",
          "type": "low"
        },
        {
          "height": 0.36,
          "time": "2021-01-09T18:49:00+07:00",
          "type": "high"
        }
      ],
      "pressure_data": [
        {
          "time": "2021-01-09T09:00:00+07:00",
          "pressure": 1020.03
        },
        {
          "time": "2021-01-09T10:00:00+07:00",
          "pressure": 1020.11
        },
        {
          "time": "2021-01-09T11:00:00+07:00",
          "pressure": 1019.21
        },
        {
          "time": "2021-01-09T12:00:00+07:00",
          "pressure": 1018.31
        },
        {
          "time": "2021-01-09T13:00:00+07:00",
          "pressure": 1017.41
        },
        {
          "time": "2021-01-09T14:00:00+07:00",
          "pressure": 1016.79
        },
        {
          "time": "2021-01-09T15:00:00+07:00",
          "pressure": 1016.17
        },
        {
          "time": "2021-01-09T16:00:00+07:00",
          "pressure": 1015.55
        }
      ],
      "fish_caught": NaN,
      "user_score": NaN,
      "user_notes": NaN
    },
    {
      "vietnam_date": "10/01/2021",
      "lunar_date": "27/11",
      "tidal_data": [
        {
          "height": -0.41,
          "time": "2021-01-10T02:15:00+07:00",
          "type": "low"
        },
        {
          "height": 0.13,
          "time": "2021-01-10T09:03:00+07:00",
          "type": "high"
        },
        {
          "height": 0.01,
          "time": "2021-01-10T13:03:00+07:00",
          "type": "low"
        },
        {
          "height": 0.4,
          "time": "2021-01-10T19:31:00+07:00",
          "type": "high"
        }
      ],
      "pressure_data": [
        {
          "time": "2021-01-10T09:00:00+07:00",
          "pressure": 1019.26
        },
        {
          "time": "2021-01-10T10:00:00+07:00",
          "pressure": 1019.69
        },
        {
          "time": "2021-01-10T11:00:00+07:00",
          "pressure": 1018.75
        },
        {
          "time": "2021-01-10T12:00:00+07:00",
          "pressure": 1017.82
        },
        {
          "time": "2021-01-10T13:00:00+07:00",
          "pressure": 1016.88
        },
        {
          "time": "2021-01-10T14:00:00+07:00",
          "pressure": 1016.21
        },
        {
          "time": "2021-01-10T15:00:00+07:00",
          "pressure": 1015.54
        },
        {
          "time": "2021-01-10T16:00:00+07:00",
          "pressure": 1014.88
        }
      ],
      "fish_caught": NaN,
      "user_score": NaN,
      "user_notes": NaN
    },
    {
      "vietnam_date": "11/01/2021",
      "lunar_date": "28/11",
      "tidal_data": [
        {
          "height": -0.5,
          "time": "2021-01-11T03:10:00+07:00",
          "type": "low"
        },
        {
          "height": 0.15,
          "time": "2021-01-11T10:15:00+07:00",
          "type": "high"
        },
        {
          "height": 0.06,
          "time": "2021-01-11T13:53:00+07:00",
          "type": "low"
        },
        {
          "height": 0.42,
          "time": "2021-01-11T20:15:00+07:00",
          "type": "high"
        }
      ],
      "pressure_data": [
        {
          "time": "2021-01-11T09:00:00+07:00",
          "pressure": 1021.31
        },
        {
          "time": "2021-01-11T10:00:00+07:00",
          "pressure": 1022.09
        },
        {
          "time": "2021-01-11T11:00:00+07:00",
          "pressure": 1021.54
        },
        {
          "time": "2021-01-11T12:00:00+07:00",
          "pressure": 1020.99
        },
        {
          "time": "2021-01-11T13:00:00+07:00",
          "pressure": 1020.44
        },
        {
          "time": "2021-01-11T14:00:00+07:00",
          "pressure": 1020.22
        },
        {
          "time": "2021-01-11T15:00:00+07:00",
          "pressure": 1020.01
        },
        {
          "time": "2021-01-11T16:00:00+07:00",
          "pressure": 1019.79
        }
      ],
      "fish_caught": NaN,
      "user_score": NaN,
      "user_notes": NaN
    },
    {
      "vietnam_date": "12/01/2021",
      "lunar_date": "29/11",
      "tidal_data": [
        {
          "height": -0.57,
          "time": "2021-01-12T04:01:00+07:00",
          "type": "low"
        },
        {
          "height": 0.17,
          "time": "2021-01-12T11:18:00+07:00",
          "type": "high"
        },
        {
          "height": 0.09,
          "time": "2021-01-12T14:41:00+07:00",
          "type": "low"
        },
        {
          "height": 0.44,
          "time": "2021-01-12T20:58:00+07:00",
          "type": "high"
        }
      ],
      "pressure_data": [
        {
          "time": "2021-01-12T09:00:00+07:00",
          "pressure": 1023.55
        },
        {
          "time": "2021-01-12T10:00:00+07:00",
          "pressure": 1023.53
        },
        {
          "time": "2021-01-12T11:00:00+07:00",
          "pressure": 1022.32
        },
        {
          "time": "2021-01-12T12:00:00+07:00",
          "pressure": 1021.11
        },
        {
          "time": "2021-01-12T13:00:00+07:00",
          "pressure": 1019.9
        },
        {
          "time": "2021-01-12T14:00:00+07:00",
          "pressure": 1019.25
        },
        {
          "time": "2021-01-12T15:00:00+07:00",
          "pressure": 1018.61
        },
        {
          "time": "2021-01-12T16:00:00+07:00",
          "pressure": 1017.96
        }
      ],
      "fish_caught": NaN,
      "user_score": NaN,
      "user_notes": NaN
    },
    {
      "vietnam_date": "13/01/2021",
      "lunar_date": "01/12",
      "tidal_data": [
        {
          "height": -0.6,
          "time": "2021-01-13T04:49:00+07:00",
          "type": "low"
        },
        {
          "height": 0.18,
          "time": "2021-01-13T12:13:00+07:00",
          "type": "high"
        },
        {
          "height": 0.11,
          "time": "2021-01-13T15:28:00+07:00",
          "type": "low"
        },
        {
          "height": 0.43,
          "time": "2021-01-13T21:40:00+07:00",
          "type": "high"
        }
      ],
      "pressure_data": [
        {
          "time": "2021-01-13T09:00:00+07:00",
          "pressure": 1019.16
        },
        {
          "time": "2021-01-13T10:00:00+07:00",
          "pressure": 1019.33
        },
        {
          "time": "2021-01-13T11:00:00+07:00",
          "pressure": 1018.21
        },
        {
          "time": "2021-01-13T12:00:00+07:00",
          "pressure": 1017.09
        },
        {
          "time": "2021-01-13T13:00:00+07:00",
          "pressure": 1015.96
        },
        {
          "time": "2021-01-13T14:00:00+07:00",
          "pressure": 1015.29
        },
        {
          "time": "2021-01-13T15:00:00+07:00",
          "pressure": 1014.62
        },
        {
          "time": "2021-01-13T16:00:00+07:00",
          "pressure": 1013.94
        }
      ],
      "fish_caught": NaN,
      "user_score": NaN,
      "user_notes": NaN
    },
    {
      "vietnam_date": "14/01/2021",
      "lunar_date": "02/12",
      "tidal_data": [
        {
          "height": -0.6,
          "time": "2021-01-14T05:33:00+07:00",
          "type": "low"
        },
        {
          "height": 0.18,
          "time": "2021-01-14T13:02:00+07:00",
          "type": "high"
        },
        {
          "height": 0.12,
          "time": "2021-01-14T16:15:00+07:00",
          "type": "low"
        },
        {
          "height": 0.41,
          "time": "2021-01-14T22:22:00+07:00",
          "type": "high"
        }
      ],
      "pressure_data": [
        {
          "time": "2021-01-14T09:00:00+07:00",
          "pressure": 1017.12
        },
        {
          "time": "2021-01-14T10:00:00+07:00",
          "pressure": 1017.33
        },
        {
          "time": "2021-01-14T11:00:00+07:00",
          "pressure": 1016.47
        },
        {
          "time": "2021-01-14T12:00:00+07:00",
          "pressure": 1015.61
        },
        {
          "time": "2021-01-14T13:00:00+07:00",
          "pressure": 1014.74
        },
        {
          "time": "2021-01-14T14:00:00+07:00",
          "pressure": 1014.08
        },
        {
          "time": "2021-01-14T15:00:00+07:00",
          "pressure": 1013.42
        },
        {
          "time": "2021-01-14T16:00:00+07:00",
          "pressure": 1012.76
        }
      ],
      "fish_caught": NaN,
      "user_score": NaN,
      "user_notes": NaN
    },
    {
      "vietnam_date": "15/01/2021",
      "lunar_date": "03/12",
      "tidal_data": [
        {
          "height": -0.58,
          "time": "2021-01-15T06:15:00+07:00",
          "type": "low"
        },
        {
          "height": 0.18,
          "time": "2021-01-15T13:44:00+07:00",
          "type": "high"
        },
        {
          "height": 0.12,
          "time": "2021-01-15T17:04:00+07:00",
          "type": "low"
        },
        {
          "height": 0.37,
          "time": "2021-01-15T23:03:00+07:00",
          "type": "high"
        }
      ],
      "pressure_data": [
        {
          "time": "2021-01-15T09:00:00+07:00",
          "pressure": 1015.35
        },
        {
          "time": "2021-01-15T10:00:00+07:00",
          "pressure": 1015.33
        },
        {
          "time": "2021-01-15T11:00:00+07:00",
          "pressure": 1014.52
        },
        {
          "time": "2021-01-15T12:00:00+07:00",
          "pressure": 1013.71
        },
        {
          "time": "2021-01-15T13:00:00+07:00",
          "pressure": 1012.91
        },
        {
          "time": "2021-01-15T14:00:00+07:00",
          "pressure": 1012.25
        },
        {
          "time": "2021-01-15T15:00:00+07:00",
          "pressure": 1011.59
        },
        {
          "time": "2021-01-15T16:00:00+07:00",
          "pressure": 1010.93
        }
      ],
      "fish_caught": NaN,
      "user_score": NaN,
      "user_notes": NaN
    },
    {
      "vietnam_date": "16/01/2021",
      "lunar_date": "04/12",
      "tidal_data": [
        {
          "height": -0.52,
          "time": "2021-01-16T06:52:00+07:00",
          "type": "low"
        },
        {
          "height": 0.18,
          "time": "2021-01-16T14:21:00+07:00",
          "type": "high"
        },
        {
          "height": 0.11,
          "time": "2021-01-16T18:00:00+07:00",
          "type": "low"
        },
        {
          "height": 0.31,
          "time": "2021-01-16T23:44:00+07:00",
          "type": "high"
        }
      ],
      "pressure_data": [
        {
          "time": "2021-01-16T09:00:00+07:00",
          "pressure": 1015.43
        },
        {
          "time": "2021-01-16T10:00:00+07:00",
          "pressure": 1015.51
        },
        {
          "time": "2021-01-16T11:00:00+07:00",
          "pressure": 1014.5
        },
        {
          "time": "2021-01-16T12:00:00+07:00",
          "pressure": 1013.49
        },
        {
          "time": "2021-01-16T13:00:00+07:00",
          "pressure": 1012.48
        },
        {
          "time": "2021-01-16T14:00:00+07:00",
          "pressure": 1012.01
        },
        {
          "time": "2021-01-16T15:00:00+07:00",
          "pressure": 1011.55
        },
        {
          "time": "2021-01-16T16:00:00+07:00",
          "pressure": 1011.08
        }
      ],
      "fish_caught": NaN,
      "user_score": NaN,
      "user_notes": NaN
    },
    {
      "vietnam_date": "17/01/2021",
      "lunar_date": "05/12",
      "tidal_data": [
        {
          "height": -0.46,
          "time": "2021-01-17T07:27:00+07:00",
          "type": "low"
        },
        {
          "height": 0.18,
          "time": "2021-01-17T14:54:00+07:00",
          "type": "high"
        },
        {
          "height": 0.09,
          "time": "2021-01-17T19:04:00+07:00",
          "type": "low"
        }
      ],
      "pressure_data": [
        {
          "time": "2021-01-17T09:00:00+07:00",
          "pressure": 1019.46
        },
        {
          "time": "2021-01-17T10:00:00+07:00",
          "pressure": 1020.04
        },
        {
          "time": "2021-01-17T11:00:00+07:00",
          "pressure": 1019.28
        },
        {
          "time": "2021-01-17T12:00:00+07:00",
          "pressure": 1018.52
        },
        {
          "time": "2021-01-17T13:00:00+07:00",
          "pressure": 1017.76
        },
        {
          "time": "2021-01-17T14:00:00+07:00",
          "pressure": 1017.53
        },
        {
          "time": "2021-01-17T15:00:00+07:00",
          "pressure": 1017.31
        },
        {
          "time": "2021-01-17T16:00:00+07:00",
          "pressure": 1017.09
        }
      ],
      "fish_caught": NaN,
      "user_score": NaN,
      "user_notes": NaN
    },
    {
      "vietnam_date": "18/01/2021",
      "lunar_date": "06/12",
      "tidal_data": [
        {
          "height": 0.25,
          "time": "2021-01-18T00:26:00+07:00",
          "type": "high"
        },
        {
          "height": -0.39,
          "time": "2021-01-18T07:57:00+07:00",
          "type": "low"
        },
        {
          "height": 0.19,
          "time": "2021-01-18T15:25:00+07:00",
          "type": "high"
        },
        {
          "height": 0.07,
          "time": "2021-01-18T20:19:00+07:00",
          "type": "low"
        }
      ],
      "pressure_data": [
        {
          "time": "2021-01-18T09:00:00+07:00",
          "pressure": 1021.77
        },
        {
          "time": "2021-01-18T10:00:00+07:00",
          "pressure": 1022.01
        },
        {
          "time": "2021-01-18T11:00:00+07:00",
          "pressure": 1021.15
        },
        {
          "time": "2021-01-18T12:00:00+07:00",
          "pressure": 1020.3
        },
        {
          "time": "2021-01-18T13:00:00+07:00",
          "pressure": 1019.44
        },
        {
          "time": "2021-01-18T14:00:00+07:00",
          "pressure": 1018.83
        },
        {
          "time": "2021-01-18T15:00:00+07:00",
          "pressure": 1018.23
        },
        {
          "time": "2021-01-18T16:00:00+07:00",
          "pressure": 1017.62
        }
      ],
      "fish_caught": NaN,
      "user_score": NaN,
      "user_notes": NaN
    },
    {
      "vietnam_date": "19/01/2021",
      "lunar_date": "07/12",
      "tidal_data": [
        {
          "height": 0.17,
          "time": "2021-01-19T01:13:00+07:00",
          "type": "high"
        },
        {
          "height": -0.31,
          "time": "2021-01-19T08:25:00+07:00",
          "type": "low"
        },
        {
          "height": 0.21,
          "time": "2021-01-19T15:55:00+07:00",
          "type": "high"
        },
        {
          "height": 0.02,
          "time": "2021-01-19T21:45:00+07:00",
          "type": "low"
        }
      ],
      "pressure_data": [
        {
          "time": "2021-01-19T09:00:00+07:00",
          "pressure": 1018.49
        },
        {
          "time": "2021-01-19T10:00:00+07:00",
          "pressure": 1018.7
        },
        {
          "time": "2021-01-19T11:00:00+07:00",
          "pressure": 1017.84
        },
        {
          "time": "2021-01-19T12:00:00+07:00",
          "pressure": 1016.99
        },
        {
          "time": "2021-01-19T13:00:00+07:00",
          "pressure": 1016.13
        },
        {
          "time": "2021-01-19T14:00:00+07:00",
          "pressure": 1015.33
        },
        {
          "time": "2021-01-19T15:00:00+07:00",
          "pressure": 1014.52
        },
        {
          "time": "2021-01-19T16:00:00+07:00",
          "pressure": 1013.72
        }
      ],
      "fish_caught": NaN,
      "user_score": NaN,
      "user_notes": NaN
    },
    {
      "vietnam_date": "20/01/2021",
      "lunar_date": "08/12",
      "tidal_data": [
        {
          "height": 0.1,
          "time": "2021-01-20T02:10:00+07:00",
          "type": "high"
        },
        {
          "height": -0.24,
          "time": "2021-01-20T08:52:00+07:00",
          "type": "low"
        },
        {
          "height": 0.22,
          "time": "2021-01-20T16:25:00+07:00",
          "type": "high"
        },
        {
          "height": -0.04,
          "time": "2021-01-20T23:12:00+07:00",
          "type": "low"
        }
      ],
      "pressure_data": [
        {
          "time": "2021-01-20T09:00:00+07:00",
          "pressure": 1016.69
        },
        {
          "time": "2021-01-20T10:00:00+07:00",
          "pressure": 1016.69
        },
        {
          "time": "2021-01-20T11:00:00+07:00",
          "pressure": 1015.76
        },
        {
          "time": "2021-01-20T12:00:00+07:00",
          "pressure": 1014.82
        },
        {
          "time": "2021-01-20T13:00:00+07:00",
          "pressure": 1013.88
        },
        {
          "time": "2021-01-20T14:00:00+07:00",
          "pressure": 1013.3
        },
        {
          "time": "2021-01-20T15:00:00+07:00",
          "pressure": 1012.72
        },
        {
          "time": "2021-01-20T16:00:00+07:00",
          "pressure": 1012.14
        }
      ],
      "fish_caught": NaN,
      "user_score": NaN,
      "user_notes": NaN
    },
    {
      "vietnam_date": "21/01/2021",
      "lunar_date": "09/12",
      "tidal_data": [
        {
          "height": 0.03,
          "time": "2021-01-21T03:29:00+07:00",
          "type": "high"
        },
        {
          "height": -0.18,
          "time": "2021-01-21T09:20:00+07:00",
          "type": "low"
        },
        {
          "height": 0.24,
          "time": "2021-01-21T16:57:00+07:00",
          "type": "high"
        }
      ],
      "pressure_data": [
        {
          "time": "2021-01-21T09:00:00+07:00",
          "pressure": 1015.6
        },
        {
          "time": "2021-01-21T10:00:00+07:00",
          "pressure": 1015.92
        },
        {
          "time": "2021-01-21T11:00:00+07:00",
          "pressure": 1014.9
        },
        {
          "time": "2021-01-21T12:00:00+07:00",
          "pressure": 1013.87
        },
        {
          "time": "2021-01-21T13:00:00+07:00",
          "pressure": 1012.85
        },
        {
          "time": "2021-01-21T14:00:00+07:00",
          "pressure": 1012.3
        },
        {
          "time": "2021-01-21T15:00:00+07:00",
          "pressure": 1011.75
        },
        {
          "time": "2021-01-21T16:00:00+07:00",
          "pressure": 1011.21
        }
      ],
      "fish_caught": NaN,
      "user_score": NaN,
      "user_notes": NaN
    },
    {
      "vietnam_date": "22/01/2021",
      "lunar_date": "10/12",
      "tidal_data": [
        {
          "height": -0.11,
          "time": "2021-01-22T00:24:00+07:00",
          "type": "low"
        },
        {
          "height": -0.01,
          "time": "2021-01-22T05:17:00+07:00",
          "type": "high"
        },
        {
          "height": -0.11,
          "time": "2021-01-22T09:50:00+07:00",
          "type": "low"
        },
        {
          "height": 0.25,
          "time": "2021-01-22T17:30:00+07:00",
          "type": "high"
        }
      ],
      "pressure_data": [
        {
          "time": "2021-01-22T09:00:00+07:00",
          "pressure": 1014.25
        },
        {
          "time": "2021-01-22T10:00:00+07:00",
          "pressure": 1014.48
        },
        {
          "time": "2021-01-22T11:00:00+07:00",
          "pressure": 1013.69
        },
        {
          "time": "2021-01-22T12:00:00+07:00",
          "pressure": 1012.91
        },
        {
          "time": "2021-01-22T13:00:00+07:00",
          "pressure": 1012.12
        },
        {
          "time": "2021-01-22T14:00:00+07:00",
          "pressure": 1011.51
        },
        {
          "time": "2021-01-22T15:00:00+07:00",
          "pressure": 1010.91
        },
        {
          "time": "2021-01-22T16:00:00+07:00",
          "pressure": 1010.3
        }
      ],
      "fish_caught": NaN,
      "user_score": NaN,
      "user_notes": NaN
    },
    {
      "vietnam_date": "23/01/2021",
      "lunar_date": "11/12",
      "tidal_data": [
        {
          "height": -0.19,
          "time": "2021-01-23T01:19:00+07:00",
          "type": "low"
        },
        {
          "height": -0.02,
          "time": "2021-01-23T07:15:00+07:00",
          "type": "high"
        },
        {
          "height": -0.05,
          "time": "2021-01-23T10:24:00+07:00",
          "type": "low"
        },
        {
          "height": 0.27,
          "time": "2021-01-23T18:04:00+07:00",
          "type": "high"
        }
      ],
      "pressure_data": [
        {
          "time": "2021-01-23T09:00:00+07:00",
          "pressure": 1015.51
        },
        {
          "time": "2021-01-23T10:00:00+07:00",
          "pressure": 1016.08
        },
        {
          "time": "2021-01-23T11:00:00+07:00",
          "pressure": 1014.96
        },
        {
          "time": "2021-01-23T12:00:00+07:00",
          "pressure": 1013.83
        },
        {
          "time": "2021-01-23T13:00:00+07:00",
          "pressure": 1012.71
        },
        {
          "time": "2021-01-23T14:00:00+07:00",
          "pressure": 1012.43
        },
        {
          "time": "2021-01-23T15:00:00+07:00",
          "pressure": 1012.16
        },
        {
          "time": "2021-01-23T16:00:00+07:00",
          "pressure": 1011.88
        }
      ],
      "fish_caught": NaN,
      "user_score": NaN,
      "user_notes": NaN
    },
    {
      "vietnam_date": "24/01/2021",
      "lunar_date": "12/12",
      "tidal_data": [
        {
          "height": -0.28,
          "time": "2021-01-24T02:04:00+07:00",
          "type": "low"
        },
        {
          "height": 0.02,
          "time": "2021-01-24T08:59:00+07:00",
          "type": "high"
        },
        {
          "height": 0.01,
          "time": "2021-01-24T11:03:00+07:00",
          "type": "low"
        },
        {
          "height": 0.28,
          "time": "2021-01-24T18:39:00+07:00",
          "type": "high"
        }
      ],
      "pressure_data": [
        {
          "time": "2021-01-24T09:00:00+07:00",
          "pressure": 1015.96
        },
        {
          "time": "2021-01-24T10:00:00+07:00",
          "pressure": 1016.07
        },
        {
          "time": "2021-01-24T11:00:00+07:00",
          "pressure": 1014.96
        },
        {
          "time": "2021-01-24T12:00:00+07:00",
          "pressure": 1013.86
        },
        {
          "time": "2021-01-24T13:00:00+07:00",
          "pressure": 1012.75
        },
        {
          "time": "2021-01-24T14:00:00+07:00",
          "pressure": 1012.29
        },
        {
          "time": "2021-01-24T15:00:00+07:00",
          "pressure": 1011.83
        },
        {
          "time": "2021-01-24T16:00:00+07:00",
          "pressure": 1011.38
        }
      ],
      "fish_caught": NaN,
      "user_score": NaN,
      "user_notes": NaN
    },
    {
      "vietnam_date": "25/01/2021",
      "lunar_date": "13/12",
      "tidal_data": [
        {
          "height": -0.36,
          "time": "2021-01-25T02:43:00+07:00",
          "type": "low"
        },
        {
          "height": 0.06,
          "time": "2021-01-25T10:18:00+07:00",
          "type": "high"
        },
        {
          "height": 0.06,
          "time": "2021-01-25T11:52:00+07:00",
          "type": "low"
        },
        {
          "height": 0.3,
          "time": "2021-01-25T19:14:00+07:00",
          "type": "high"
        }
      ],
      "pressure_data": [
        {
          "time": "2021-01-25T09:00:00+07:00",
          "pressure": 1015.35
        },
        {
          "time": "2021-01-25T10:00:00+07:00",
          "pressure": 1015.51
        },
        {
          "time": "2021-01-25T11:00:00+07:00",
          "pressure": 1014.58
        },
        {
          "time": "2021-01-25T12:00:00+07:00",
          "pressure": 1013.65
        },
        {
          "time": "2021-01-25T13:00:00+07:00",
          "pressure": 1012.71
        },
        {
          "time": "2021-01-25T14:00:00+07:00",
          "pressure": 1012.32
        },
        {
          "time": "2021-01-25T15:00:00+07:00",
          "pressure": 1011.93
        },
        {
          "time": "2021-01-25T16:00:00+07:00",
          "pressure": 1011.54
        }
      ],
      "fish_caught": NaN,
      "user_score": NaN,
      "user_notes": NaN
    },
    {
      "vietnam_date": "26/01/2021",
      "lunar_date": "14/12",
      "tidal_data": [
        {
          "height": -0.43,
          "time": "2021-01-26T03:20:00+07:00",
          "type": "low"
        },
        {
          "height": 0.1,
          "time": "2021-01-26T11:11:00+07:00",
          "type": "high"
        },
        {
          "height": 0.1,
          "time": "2021-01-26T12:50:00+07:00",
          "type": "low"
        },
        {
          "height": 0.32,
          "time": "2021-01-26T19:50:00+07:00",
          "type": "high"
        }
      ],
      "pressure_data": [
        {
          "time": "2021-01-26T09:00:00+07:00",
          "pressure": 1016.62
        },
        {
          "time": "2021-01-26T10:00:00+07:00",
          "pressure": 1016.89
        },
        {
          "time": "2021-01-26T11:00:00+07:00",
          "pressure": 1015.85
        },
        {
          "time": "2021-01-26T12:00:00+07:00",
          "pressure": 1014.82
        },
        {
          "time": "2021-01-26T13:00:00+07:00",
          "pressure": 1013.79
        },
        {
          "time": "2021-01-26T14:00:00+07:00",
          "pressure": 1013.25
        },
        {
          "time": "2021-01-26T15:00:00+07:00",
          "pressure": 1012.71
        },
        {
          "time": "2021-01-26T16:00:00+07:00",
          "pressure": 1012.17
        }
      ],
      "fish_caught": NaN,
      "user_score": NaN,
      "user_notes": NaN
    },
    {
      "vietnam_date": "27/01/2021",
      "lunar_date": "15/12",
      "tidal_data": [
        {
          "height": -0.49,
          "time": "2021-01-27T03:56:00+07:00",
          "type": "low"
        },
        {
          "height": 0.13,
          "time": "2021-01-27T11:49:00+07:00",
          "type": "high"
        },
        {
          "height": 0.12,
          "time": "2021-01-27T13:49:00+07:00",
          "type": "low"
        },
        {
          "height": 0.35,
          "time": "2021-01-27T20:29:00+07:00",
          "type": "high"
        }
      ],
      "pressure_data": [
        {
          "time": "2021-01-27T09:00:00+07:00",
          "pressure": 1016.14
        },
        {
          "time": "2021-01-27T10:00:00+07:00",
          "pressure": 1016.56
        },
        {
          "time": "2021-01-27T11:00:00+07:00",
          "pressure": 1015.58
        },
        {
          "time": "2021-01-27T12:00:00+07:00",
          "pressure": 1014.6
        },
        {
          "time": "2021-01-27T13:00:00+07:00",
          "pressure": 1013.62
        },
        {
          "time": "2021-01-27T14:00:00+07:00",
          "pressure": 1013.33
        },
        {
          "time": "2021-01-27T15:00:00+07:00",
          "pressure": 1013.05
        },
        {
          "time": "2021-01-27T16:00:00+07:00",
          "pressure": 1012.76
        }
      ],
      "fish_caught": NaN,
      "user_score": NaN,
      "user_notes": NaN
    },
    {
      "vietnam_date": "28/01/2021",
      "lunar_date": "16/12",
      "tidal_data": [
        {
          "height": -0.53,
          "time": "2021-01-28T04:32:00+07:00",
          "type": "low"
        },
        {
          "height": 0.15,
          "time": "2021-01-28T12:19:00+07:00",
          "type": "high"
        },
        {
          "height": 0.13,
          "time": "2021-01-28T14:45:00+07:00",
          "type": "low"
        },
        {
          "height": 0.37,
          "time": "2021-01-28T21:11:00+07:00",
          "type": "high"
        }
      ],
      "pressure_data": [
        {
          "time": "2021-01-28T09:00:00+07:00",
          "pressure": 1019.68
        },
        {
          "time": "2021-01-28T10:00:00+07:00",
          "pressure": 1020.48
        },
        {
          "time": "2021-01-28T11:00:00+07:00",
          "pressure": 1019.63
        },
        {
          "time": "2021-01-28T12:00:00+07:00",
          "pressure": 1018.77
        },
        {
          "time": "2021-01-28T13:00:00+07:00",
          "pressure": 1017.91
        },
        {
          "time": "2021-01-28T14:00:00+07:00",
          "pressure": 1017.5
        },
        {
          "time": "2021-01-28T15:00:00+07:00",
          "pressure": 1017.09
        },
        {
          "time": "2021-01-28T16:00:00+07:00",
          "pressure": 1016.67
        }
      ],
      "fish_caught": NaN,
      "user_score": NaN,
      "user_notes": NaN
    },
    {
      "vietnam_date": "29/01/2021",
      "lunar_date": "17/12",
      "tidal_data": [
        {
          "height": -0.55,
          "time": "2021-01-29T05:08:00+07:00",
          "type": "low"
        },
        {
          "height": 0.16,
          "time": "2021-01-29T12:46:00+07:00",
          "type": "high"
        },
        {
          "height": 0.12,
          "time": "2021-01-29T15:39:00+07:00",
          "type": "low"
        },
        {
          "height": 0.38,
          "time": "2021-01-29T21:56:00+07:00",
          "type": "high"
        }
      ],
      "pressure_data": [
        {
          "time": "2021-01-29T09:00:00+07:00",
          "pressure": 1020.33
        },
        {
          "time": "2021-01-29T10:00:00+07:00",
          "pressure": 1020.78
        },
        {
          "time": "2021-01-29T11:00:00+07:00",
          "pressure": 1019.7
        },
        {
          "time": "2021-01-29T12:00:00+07:00",
          "pressure": 1018.63
        },
        {
          "time": "2021-01-29T13:00:00+07:00",
          "pressure": 1017.55
        },
        {
          "time": "2021-01-29T14:00:00+07:00",
          "pressure": 1017.21
        },
        {
          "time": "2021-01-29T15:00:00+07:00",
          "pressure": 1016.86
        },
        {
          "time": "2021-01-29T16:00:00+07:00",
          "pressure": 1016.52
        }
      ],
      "fish_caught": NaN,
      "user_score": NaN,
      "user_notes": NaN
    },
    {
      "vietnam_date": "30/01/2021",
      "lunar_date": "18/12",
      "tidal_data": [
        {
          "height": -0.55,
          "time": "2021-01-30T05:44:00+07:00",
          "type": "low"
        },
        {
          "height": 0.17,
          "time": "2021-01-30T13:11:00+07:00",
          "type": "high"
        },
        {
          "height": 0.09,
          "time": "2021-01-30T16:34:00+07:00",
          "type": "low"
        },
        {
          "height": 0.38,
          "time": "2021-01-30T22:45:00+07:00",
          "type": "high"
        }
      ],
      "pressure_data": [
        {
          "time": "2021-01-30T09:00:00+07:00",
          "pressure": 1019.17
        },
        {
          "time": "2021-01-30T10:00:00+07:00",
          "pressure": 1019.33
        },
        {
          "time": "2021-01-30T11:00:00+07:00",
          "pressure": 1018.51
        },
        {
          "time": "2021-01-30T12:00:00+07:00",
          "pressure": 1017.69
        },
        {
          "time": "2021-01-30T13:00:00+07:00",
          "pressure": 1016.88
        },
        {
          "time": "2021-01-30T14:00:00+07:00",
          "pressure": 1016.29
        },
        {
          "time": "2021-01-30T15:00:00+07:00",
          "pressure": 1015.71
        },
        {
          "time": "2021-01-30T16:00:00+07:00",
          "pressure": 1015.12
        }
      ],
      "fish_caught": NaN,
      "user_score": NaN,
      "user_notes": NaN
    },
    {
      "vietnam_date": "31/01/2021",
      "lunar_date": "19/12",
      "tidal_data": [
        {
          "height": -0.51,
          "time": "2021-01-31T06:21:00+07:00",
          "type": "low"
        },
        {
          "height": 0.17,
          "time": "2021-01-31T13:35:00+07:00",
          "type": "high"
        },
        {
          "height": 0.05,
          "time": "2021-01-31T17:32:00+07:00",
          "type": "low"
        },
        {
          "height": 0.37,
          "time": "2021-01-31T23:38:00+07:00",
          "type": "high"
        }
      ],
      "pressure_data": [
        {
          "time": "2021-01-31T09:00:00+07:00",
          "pressure": 1018.77
        },
        {
          "time": "2021-01-31T10:00:00+07:00",
          "pressure": 1019.16
        },
        {
          "time": "2021-01-31T11:00:00+07:00",
          "pressure": 1018.23
        },
        {
          "time": "2021-01-31T12:00:00+07:00",
          "pressure": 1017.3
        },
        {
          "time": "2021-01-31T13:00:00+07:00",
          "pressure": 1016.37
        },
        {
          "time": "2021-01-31T14:00:00+07:00",
          "pressure": 1015.82
        },
        {
          "time": "2021-01-31T15:00:00+07:00",
          "pressure": 1015.27
        },
        {
          "time": "2021-01-31T16:00:00+07:00",
          "pressure": 1014.73
        }
      ],
      "fish_caught": NaN,
      "user_score": NaN,
      "user_notes": NaN
    },
    {
      "vietnam_date": "01/02/2021",
      "lunar_date": "20/12",
      "tidal_data": [
        {
          "height": -0.46,
          "time": "2021-02-01T06:59:00+07:00",
          "type": "low"
        },
        {
          "height": 0.19,
          "time": "2021-02-01T14:02:00+07:00",
          "type": "high"
        },
        {
          "height": -0.0,
          "time": "2021-02-01T18:33:00+07:00",
          "type": "low"
        }
      ],
      "pressure_data": [
        {
          "time": "2021-02-01T09:00:00+07:00",
          "pressure": 1019.09
        },
        {
          "time": "2021-02-01T10:00:00+07:00",
          "pressure": 1019.43
        },
        {
          "time": "2021-02-01T11:00:00+07:00",
          "pressure": 1018.51
        },
        {
          "time": "2021-02-01T12:00:00+07:00",
          "pressure": 1017.58
        },
        {
          "time": "2021-02-01T13:00:00+07:00",
          "pressure": 1016.65
        },
        {
          "time": "2021-02-01T14:00:00+07:00",
          "pressure": 1015.95
        },
        {
          "time": "2021-02-01T15:00:00+07:00",
          "pressure": 1015.24
        },
        {
          "time": "2021-02-01T16:00:00+07:00",
          "pressure": 1014.54
        }
      ],
      "fish_caught": NaN,
      "user_score": NaN,
      "user_notes": NaN
    },
    {
      "vietnam_date": "02/02/2021",
      "lunar_date": "21/12",
      "tidal_data": [
        {
          "height": 0.32,
          "time": "2021-02-02T00:36:00+07:00",
          "type": "high"
        },
        {
          "height": -0.39,
          "time": "2021-02-02T07:38:00+07:00",
          "type": "low"
        },
        {
          "height": 0.21,
          "time": "2021-02-02T14:31:00+07:00",
          "type": "high"
        },
        {
          "height": -0.06,
          "time": "2021-02-02T19:40:00+07:00",
          "type": "low"
        }
      ],
      "pressure_data": [
        {
          "time": "2021-02-02T09:00:00+07:00",
          "pressure": 1019.28
        },
        {
          "time": "2021-02-02T10:00:00+07:00",
          "pressure": 1019.65
        },
        {
          "time": "2021-02-02T11:00:00+07:00",
          "pressure": 1018.72
        },
        {
          "time": "2021-02-02T12:00:00+07:00",
          "pressure": 1017.78
        },
        {
          "time": "2021-02-02T13:00:00+07:00",
          "pressure": 1016.84
        },
        {
          "time": "2021-02-02T14:00:00+07:00",
          "pressure": 1016.4
        },
        {
          "time": "2021-02-02T15:00:00+07:00",
          "pressure": 1015.96
        },
        {
          "time": "2021-02-02T16:00:00+07:00",
          "pressure": 1015.51
        }
      ],
      "fish_caught": NaN,
      "user_score": NaN,
      "user_notes": NaN
    },
    {
      "vietnam_date": "03/02/2021",
      "lunar_date": "22/12",
      "tidal_data": [
        {
          "height": 0.26,
          "time": "2021-02-03T01:40:00+07:00",
          "type": "high"
        },
        {
          "height": -0.3,
          "time": "2021-02-03T08:18:00+07:00",
          "type": "low"
        },
        {
          "height": 0.23,
          "time": "2021-02-03T15:03:00+07:00",
          "type": "high"
        },
        {
          "height": -0.13,
          "time": "2021-02-03T20:54:00+07:00",
          "type": "low"
        }
      ],
      "pressure_data": [
        {
          "time": "2021-02-03T09:00:00+07:00",
          "pressure": 1019.71
        },
        {
          "time": "2021-02-03T10:00:00+07:00",
          "pressure": 1019.92
        },
        {
          "time": "2021-02-03T11:00:00+07:00",
          "pressure": 1019.03
        },
        {
          "time": "2021-02-03T12:00:00+07:00",
          "pressure": 1018.14
        },
        {
          "time": "2021-02-03T13:00:00+07:00",
          "pressure": 1017.25
        },
        {
          "time": "2021-02-03T14:00:00+07:00",
          "pressure": 1016.78
        },
        {
          "time": "2021-02-03T15:00:00+07:00",
          "pressure": 1016.31
        },
        {
          "time": "2021-02-03T16:00:00+07:00",
          "pressure": 1015.84
        }
      ],
      "fish_caught": NaN,
      "user_score": NaN,
      "user_notes": NaN
    },
    {
      "vietnam_date": "04/02/2021",
      "lunar_date": "23/12",
      "tidal_data": [
        {
          "height": 0.19,
          "time": "2021-02-04T02:55:00+07:00",
          "type": "high"
        },
        {
          "height": -0.21,
          "time": "2021-02-04T08:59:00+07:00",
          "type": "low"
        },
        {
          "height": 0.26,
          "time": "2021-02-04T15:40:00+07:00",
          "type": "high"
        },
        {
          "height": -0.2,
          "time": "2021-02-04T22:12:00+07:00",
          "type": "low"
        }
      ],
      "pressure_data": [
        {
          "time": "2021-02-04T09:00:00+07:00",
          "pressure": 1020.34
        },
        {
          "time": "2021-02-04T10:00:00+07:00",
          "pressure": 1020.46
        },
        {
          "time": "2021-02-04T11:00:00+07:00",
          "pressure": 1019.52
        },
        {
          "time": "2021-02-04T12:00:00+07:00",
          "pressure": 1018.58
        },
        {
          "time": "2021-02-04T13:00:00+07:00",
          "pressure": 1017.64
        },
        {
          "time": "2021-02-04T14:00:00+07:00",
          "pressure": 1016.98
        },
        {
          "time": "2021-02-04T15:00:00+07:00",
          "pressure": 1016.33
        },
        {
          "time": "2021-02-04T16:00:00+07:00",
          "pressure": 1015.68
        }
      ],
      "fish_caught": NaN,
      "user_score": NaN,
      "user_notes": NaN
    },
    {
      "vietnam_date": "05/02/2021",
      "lunar_date": "24/12",
      "tidal_data": [
        {
          "height": 0.13,
          "time": "2021-02-05T04:25:00+07:00",
          "type": "high"
        },
        {
          "height": -0.12,
          "time": "2021-02-05T09:43:00+07:00",
          "type": "low"
        },
        {
          "height": 0.29,
          "time": "2021-02-05T16:23:00+07:00",
          "type": "high"
        },
        {
          "height": -0.29,
          "time": "2021-02-05T23:33:00+07:00",
          "type": "low"
        }
      ],
      "pressure_data": [
        {
          "time": "2021-02-05T09:00:00+07:00",
          "pressure": 1018.62
        },
        {
          "time": "2021-02-05T10:00:00+07:00",
          "pressure": 1019.0
        },
        {
          "time": "2021-02-05T11:00:00+07:00",
          "pressure": 1018.18
        },
        {
          "time": "2021-02-05T12:00:00+07:00",
          "pressure": 1017.37
        },
        {
          "time": "2021-02-05T13:00:00+07:00",
          "pressure": 1016.55
        },
        {
          "time": "2021-02-05T14:00:00+07:00",
          "pressure": 1015.89
        },
        {
          "time": "2021-02-05T15:00:00+07:00",
          "pressure": 1015.23
        },
        {
          "time": "2021-02-05T16:00:00+07:00",
          "pressure": 1014.57
        }
      ],
      "fish_caught": NaN,
      "user_score": NaN,
      "user_notes": NaN
    },
    {
      "vietnam_date": "06/02/2021",
      "lunar_date": "25/12",
      "tidal_data": [
        {
          "height": 0.09,
          "time": "2021-02-06T06:09:00+07:00",
          "type": "high"
        },
        {
          "height": -0.04,
          "time": "2021-02-06T10:29:00+07:00",
          "type": "low"
        },
        {
          "height": 0.32,
          "time": "2021-02-06T17:10:00+07:00",
          "type": "high"
        }
      ],
      "pressure_data": [
        {
          "time": "2021-02-06T09:00:00+07:00",
          "pressure": 1017.59
        },
        {
          "time": "2021-02-06T10:00:00+07:00",
          "pressure": 1017.93
        },
        {
          "time": "2021-02-06T11:00:00+07:00",
          "pressure": 1016.9
        },
        {
          "time": "2021-02-06T12:00:00+07:00",
          "pressure": 1015.86
        },
        {
          "time": "2021-02-06T13:00:00+07:00",
          "pressure": 1014.83
        },
        {
          "time": "2021-02-06T14:00:00+07:00",
          "pressure": 1014.15
        },
        {
          "time": "2021-02-06T15:00:00+07:00",
          "pressure": 1013.48
        },
        {
          "time": "2021-02-06T16:00:00+07:00",
          "pressure": 1012.8
        }
      ],
      "fish_caught": NaN,
      "user_score": NaN,
      "user_notes": NaN
    },
    {
      "vietnam_date": "07/02/2021",
      "lunar_date": "26/12",
      "tidal_data": [
        {
          "height": -0.37,
          "time": "2021-02-07T00:49:00+07:00",
          "type": "low"
        },
        {
          "height": 0.1,
          "time": "2021-02-07T07:54:00+07:00",
          "type": "high"
        },
        {
          "height": 0.03,
          "time": "2021-02-07T11:23:00+07:00",
          "type": "low"
        },
        {
          "height": 0.35,
          "time": "2021-02-07T18:03:00+07:00",
          "type": "high"
        }
      ],
      "pressure_data": [
        {
          "time": "2021-02-07T09:00:00+07:00",
          "pressure": 1016.32
        },
        {
          "time": "2021-02-07T10:00:00+07:00",
          "pressure": 1016.5
        },
        {
          "time": "2021-02-07T11:00:00+07:00",
          "pressure": 1015.72
        },
        {
          "time": "2021-02-07T12:00:00+07:00",
          "pressure": 1014.94
        },
        {
          "time": "2021-02-07T13:00:00+07:00",
          "pressure": 1014.17
        },
        {
          "time": "2021-02-07T14:00:00+07:00",
          "pressure": 1013.71
        },
        {
          "time": "2021-02-07T15:00:00+07:00",
          "pressure": 1013.25
        },
        {
          "time": "2021-02-07T16:00:00+07:00",
          "pressure": 1012.79
        }
      ],
      "fish_caught": NaN,
      "user_score": NaN,
      "user_notes": NaN
    },
    {
      "vietnam_date": "08/02/2021",
      "lunar_date": "27/12",
      "tidal_data": [
        {
          "height": -0.45,
          "time": "2021-02-08T01:58:00+07:00",
          "type": "low"
        },
        {
          "height": 0.12,
          "time": "2021-02-08T09:23:00+07:00",
          "type": "high"
        },
        {
          "height": 0.08,
          "time": "2021-02-08T12:26:00+07:00",
          "type": "low"
        },
        {
          "height": 0.37,
          "time": "2021-02-08T18:58:00+07:00",
          "type": "high"
        }
      ],
      "pressure_data": [
        {
          "time": "2021-02-08T09:00:00+07:00",
          "pressure": 1016.25
        },
        {
          "time": "2021-02-08T10:00:00+07:00",
          "pressure": 1016.32
        },
        {
          "time": "2021-02-08T11:00:00+07:00",
          "pressure": 1015.68
        },
        {
          "time": "2021-02-08T12:00:00+07:00",
          "pressure": 1015.04
        },
        {
          "time": "2021-02-08T13:00:00+07:00",
          "pressure": 1014.4
        },
        {
          "time": "2021-02-08T14:00:00+07:00",
          "pressure": 1013.88
        },
        {
          "time": "2021-02-08T15:00:00+07:00",
          "pressure": 1013.35
        },
        {
          "time": "2021-02-08T16:00:00+07:00",
          "pressure": 1012.83
        }
      ],
      "fish_caught": NaN,
      "user_score": NaN,
      "user_notes": NaN
    },
    {
      "vietnam_date": "09/02/2021",
      "lunar_date": "28/12",
      "tidal_data": [
        {
          "height": -0.51,
          "time": "2021-02-09T02:57:00+07:00",
          "type": "low"
        },
        {
          "height": 0.15,
          "time": "2021-02-09T10:28:00+07:00",
          "type": "high"
        },
        {
          "height": 0.1,
          "time": "2021-02-09T13:37:00+07:00",
          "type": "low"
        },
        {
          "height": 0.38,
          "time": "2021-02-09T19:53:00+07:00",
          "type": "high"
        }
      ],
      "pressure_data": [
        {
          "time": "2021-02-09T09:00:00+07:00",
          "pressure": 1014.14
        },
        {
          "time": "2021-02-09T10:00:00+07:00",
          "pressure": 1014.34
        },
        {
          "time": "2021-02-09T11:00:00+07:00",
          "pressure": 1013.4
        },
        {
          "time": "2021-02-09T12:00:00+07:00",
          "pressure": 1012.45
        },
        {
          "time": "2021-02-09T13:00:00+07:00",
          "pressure": 1011.5
        },
        {
          "time": "2021-02-09T14:00:00+07:00",
          "pressure": 1011.24
        },
        {
          "time": "2021-02-09T15:00:00+07:00",
          "pressure": 1010.97
        },
        {
          "time": "2021-02-09T16:00:00+07:00",
          "pressure": 1010.7
        }
      ],
      "fish_caught": NaN,
      "user_score": NaN,
      "user_notes": NaN
    },
    {
      "vietnam_date": "10/02/2021",
      "lunar_date": "29/12",
      "tidal_data": [
        {
          "height": -0.55,
          "time": "2021-02-10T03:50:00+07:00",
          "type": "low"
        },
        {
          "height": 0.17,
          "time": "2021-02-10T11:17:00+07:00",
          "type": "high"
        },
        {
          "height": 0.11,
          "time": "2021-02-10T14:44:00+07:00",
          "type": "low"
        },
        {
          "height": 0.38,
          "time": "2021-02-10T20:45:00+07:00",
          "type": "high"
        }
      ],
      "pressure_data": [
        {
          "time": "2021-02-10T09:00:00+07:00",
          "pressure": 1015.31
        },
        {
          "time": "2021-02-10T10:00:00+07:00",
          "pressure": 1015.68
        },
        {
          "time": "2021-02-10T11:00:00+07:00",
          "pressure": 1014.9
        },
        {
          "time": "2021-02-10T12:00:00+07:00",
          "pressure": 1014.13
        },
        {
          "time": "2021-02-10T13:00:00+07:00",
          "pressure": 1013.35
        },
        {
          "time": "2021-02-10T14:00:00+07:00",
          "pressure": 1012.82
        },
        {
          "time": "2021-02-10T15:00:00+07:00",
          "pressure": 1012.3
        },
        {
          "time": "2021-02-10T16:00:00+07:00",
          "pressure": 1011.77
        }
      ],
      "fish_caught": NaN,
      "user_score": NaN,
      "user_notes": NaN
    },
    {
      "vietnam_date": "11/02/2021",
      "lunar_date": "30/12",
      "tidal_data": [
        {
          "height": -0.55,
          "time": "2021-02-11T04:36:00+07:00",
          "type": "low"
        },
        {
          "height": 0.18,
          "time": "2021-02-11T11:54:00+07:00",
          "type": "high"
        },
        {
          "height": 0.09,
          "time": "2021-02-11T15:44:00+07:00",
          "type": "low"
        },
        {
          "height": 0.37,
          "time": "2021-02-11T21:35:00+07:00",
          "type": "high"
        }
      ],
      "pressure_data": [
        {
          "time": "2021-02-11T09:00:00+07:00",
          "pressure": 1016.68
        },
        {
          "time": "2021-02-11T10:00:00+07:00",
          "pressure": 1016.87
        },
        {
          "time": "2021-02-11T11:00:00+07:00",
          "pressure": 1015.87
        },
        {
          "time": "2021-02-11T12:00:00+07:00",
          "pressure": 1014.87
        },
        {
          "time": "2021-02-11T13:00:00+07:00",
          "pressure": 1013.87
        },
        {
          "time": "2021-02-11T14:00:00+07:00",
          "pressure": 1013.28
        },
        {
          "time": "2021-02-11T15:00:00+07:00",
          "pressure": 1012.7
        },
        {
          "time": "2021-02-11T16:00:00+07:00",
          "pressure": 1012.11
        }
      ],
      "fish_caught": NaN,
      "user_score": NaN,
      "user_notes": NaN
    },
    {
      "vietnam_date": "12/02/2021",
      "lunar_date": "01/01",
      "tidal_data": [
        {
          "height": -0.53,
          "time": "2021-02-12T05:17:00+07:00",
          "type": "low"
        },
        {
          "height": 0.18,
          "time": "2021-02-12T12:25:00+07:00",
          "type": "high"
        },
        {
          "height": 0.07,
          "time": "2021-02-12T16:36:00+07:00",
          "type": "low"
        },
        {
          "height": 0.35,
          "time": "2021-02-12T22:22:00+07:00",
          "type": "high"
        }
      ],
      "pressure_data": [
        {
          "time": "2021-02-12T09:00:00+07:00",
          "pressure": 1017.67
        },
        {
          "time": "2021-02-12T10:00:00+07:00",
          "pressure": 1018.0
        },
        {
          "time": "2021-02-12T11:00:00+07:00",
          "pressure": 1017.04
        },
        {
          "time": "2021-02-12T12:00:00+07:00",
          "pressure": 1016.08
        },
        {
          "time": "2021-02-12T13:00:00+07:00",
          "pressure": 1015.12
        },
        {
          "time": "2021-02-12T14:00:00+07:00",
          "pressure": 1014.67
        },
        {
          "time": "2021-02-12T15:00:00+07:00",
          "pressure": 1014.21
        },
        {
          "time": "2021-02-12T16:00:00+07:00",
          "pressure": 1013.76
        }
      ],
      "fish_caught": NaN,
      "user_score": NaN,
      "user_notes": NaN
    },
    {
      "vietnam_date": "13/02/2021",
      "lunar_date": "02/01",
      "tidal_data": [
        {
          "height": -0.48,
          "time": "2021-02-13T05:53:00+07:00",
          "type": "low"
        },
        {
          "height": 0.19,
          "time": "2021-02-13T12:52:00+07:00",
          "type": "high"
        },
        {
          "height": 0.04,
          "time": "2021-02-13T17:24:00+07:00",
          "type": "low"
        },
        {
          "height": 0.31,
          "time": "2021-02-13T23:07:00+07:00",
          "type": "high"
        }
      ],
      "pressure_data": [
        {
          "time": "2021-02-13T09:00:00+07:00",
          "pressure": 1017.59
        },
        {
          "time": "2021-02-13T10:00:00+07:00",
          "pressure": 1017.47
        },
        {
          "time": "2021-02-13T11:00:00+07:00",
          "pressure": 1016.63
        },
        {
          "time": "2021-02-13T12:00:00+07:00",
          "pressure": 1015.79
        },
        {
          "time": "2021-02-13T13:00:00+07:00",
          "pressure": 1014.95
        },
        {
          "time": "2021-02-13T14:00:00+07:00",
          "pressure": 1014.38
        },
        {
          "time": "2021-02-13T15:00:00+07:00",
          "pressure": 1013.81
        },
        {
          "time": "2021-02-13T16:00:00+07:00",
          "pressure": 1013.24
        }
      ],
      "fish_caught": NaN,
      "user_score": NaN,
      "user_notes": NaN
    },
    {
      "vietnam_date": "14/02/2021",
      "lunar_date": "03/01",
      "tidal_data": [
        {
          "height": -0.42,
          "time": "2021-02-14T06:24:00+07:00",
          "type": "low"
        },
        {
          "height": 0.19,
          "time": "2021-02-14T13:17:00+07:00",
          "type": "high"
        },
        {
          "height": 0.01,
          "time": "2021-02-14T18:10:00+07:00",
          "type": "low"
        },
        {
          "height": 0.27,
          "time": "2021-02-14T23:50:00+07:00",
          "type": "high"
        }
      ],
      "pressure_data": [
        {
          "time": "2021-02-14T09:00:00+07:00",
          "pressure": 1018.23
        },
        {
          "time": "2021-02-14T10:00:00+07:00",
          "pressure": 1018.18
        },
        {
          "time": "2021-02-14T11:00:00+07:00",
          "pressure": 1017.26
        },
        {
          "time": "2021-02-14T12:00:00+07:00",
          "pressure": 1016.33
        },
        {
          "time": "2021-02-14T13:00:00+07:00",
          "pressure": 1015.41
        },
        {
          "time": "2021-02-14T14:00:00+07:00",
          "pressure": 1014.67
        },
        {
          "time": "2021-02-14T15:00:00+07:00",
          "pressure": 1013.93
        },
        {
          "time": "2021-02-14T16:00:00+07:00",
          "pressure": 1013.19
        }
      ],
      "fish_caught": NaN,
      "user_score": NaN,
      "user_notes": NaN
    },
    {
      "vietnam_date": "15/02/2021",
      "lunar_date": "04/01",
      "tidal_data": [
        {
          "height": -0.36,
          "time": "2021-02-15T06:50:00+07:00",
          "type": "low"
        },
        {
          "height": 0.2,
          "time": "2021-02-15T13:41:00+07:00",
          "type": "high"
        },
        {
          "height": -0.03,
          "time": "2021-02-15T18:57:00+07:00",
          "type": "low"
        }
      ],
      "pressure_data": [
        {
          "time": "2021-02-15T09:00:00+07:00",
          "pressure": 1016.21
        },
        {
          "time": "2021-02-15T10:00:00+07:00",
          "pressure": 1016.37
        },
        {
          "time": "2021-02-15T11:00:00+07:00",
          "pressure": 1015.2
        },
        {
          "time": "2021-02-15T12:00:00+07:00",
          "pressure": 1014.03
        },
        {
          "time": "2021-02-15T13:00:00+07:00",
          "pressure": 1012.86
        },
        {
          "time": "2021-02-15T14:00:00+07:00",
          "pressure": 1012.18
        },
        {
          "time": "2021-02-15T15:00:00+07:00",
          "pressure": 1011.5
        },
        {
          "time": "2021-02-15T16:00:00+07:00",
          "pressure": 1010.82
        }
      ],
      "fish_caught": NaN,
      "user_score": NaN,
      "user_notes": NaN
    },
    {
      "vietnam_date": "16/02/2021",
      "lunar_date": "05/01",
      "tidal_data": [
        {
          "height": 0.21,
          "time": "2021-02-16T00:34:00+07:00",
          "type": "high"
        },
        {
          "height": -0.29,
          "time": "2021-02-16T07:14:00+07:00",
          "type": "low"
        },
        {
          "height": 0.21,
          "time": "2021-02-16T14:06:00+07:00",
          "type": "high"
        },
        {
          "height": -0.06,
          "time": "2021-02-16T19:47:00+07:00",
          "type": "low"
        }
      ],
      "pressure_data": [
        {
          "time": "2021-02-16T09:00:00+07:00",
          "pressure": 1015.16
        },
        {
          "time": "2021-02-16T10:00:00+07:00",
          "pressure": 1015.34
        },
        {
          "time": "2021-02-16T11:00:00+07:00",
          "pressure": 1014.53
        },
        {
          "time": "2021-02-16T12:00:00+07:00",
          "pressure": 1013.72
        },
        {
          "time": "2021-02-16T13:00:00+07:00",
          "pressure": 1012.91
        },
        {
          "time": "2021-02-16T14:00:00+07:00",
          "pressure": 1012.43
        },
        {
          "time": "2021-02-16T15:00:00+07:00",
          "pressure": 1011.94
        },
        {
          "time": "2021-02-16T16:00:00+07:00",
          "pressure": 1011.46
        }
      ],
      "fish_caught": NaN,
      "user_score": NaN,
      "user_notes": NaN
    },
    {
      "vietnam_date": "17/02/2021",
      "lunar_date": "06/01",
      "tidal_data": [
        {
          "height": 0.15,
          "time": "2021-02-17T01:22:00+07:00",
          "type": "high"
        },
        {
          "height": -0.23,
          "time": "2021-02-17T07:36:00+07:00",
          "type": "low"
        },
        {
          "height": 0.22,
          "time": "2021-02-17T14:31:00+07:00",
          "type": "high"
        },
        {
          "height": -0.1,
          "time": "2021-02-17T20:42:00+07:00",
          "type": "low"
        }
      ],
      "pressure_data": [
        {
          "time": "2021-02-17T09:00:00+07:00",
          "pressure": 1019.1
        },
        {
          "time": "2021-02-17T10:00:00+07:00",
          "pressure": 1019.45
        },
        {
          "time": "2021-02-17T11:00:00+07:00",
          "pressure": 1018.72
        },
        {
          "time": "2021-02-17T12:00:00+07:00",
          "pressure": 1017.99
        },
        {
          "time": "2021-02-17T13:00:00+07:00",
          "pressure": 1017.27
        },
        {
          "time": "2021-02-17T14:00:00+07:00",
          "pressure": 1016.9
        },
        {
          "time": "2021-02-17T15:00:00+07:00",
          "pressure": 1016.54
        },
        {
          "time": "2021-02-17T16:00:00+07:00",
          "pressure": 1016.18
        }
      ],
      "fish_caught": NaN,
      "user_score": NaN,
      "user_notes": NaN
    },
    {
      "vietnam_date": "18/02/2021",
      "lunar_date": "07/01",
      "tidal_data": [
        {
          "height": 0.09,
          "time": "2021-02-18T02:17:00+07:00",
          "type": "high"
        },
        {
          "height": -0.17,
          "time": "2021-02-18T07:57:00+07:00",
          "type": "low"
        },
        {
          "height": 0.22,
          "time": "2021-02-18T14:58:00+07:00",
          "type": "high"
        },
        {
          "height": -0.14,
          "time": "2021-02-18T21:43:00+07:00",
          "type": "low"
        }
      ],
      "pressure_data": [
        {
          "time": "2021-02-18T09:00:00+07:00",
          "pressure": 1021.6
        },
        {
          "time": "2021-02-18T10:00:00+07:00",
          "pressure": 1022.14
        },
        {
          "time": "2021-02-18T11:00:00+07:00",
          "pressure": 1021.43
        },
        {
          "time": "2021-02-18T12:00:00+07:00",
          "pressure": 1020.72
        },
        {
          "time": "2021-02-18T13:00:00+07:00",
          "pressure": 1020.0
        },
        {
          "time": "2021-02-18T14:00:00+07:00",
          "pressure": 1019.52
        },
        {
          "time": "2021-02-18T15:00:00+07:00",
          "pressure": 1019.05
        },
        {
          "time": "2021-02-18T16:00:00+07:00",
          "pressure": 1018.57
        }
      ],
      "fish_caught": NaN,
      "user_score": NaN,
      "user_notes": NaN
    },
    {
      "vietnam_date": "19/02/2021",
      "lunar_date": "08/01",
      "tidal_data": [
        {
          "height": 0.04,
          "time": "2021-02-19T03:29:00+07:00",
          "type": "high"
        },
        {
          "height": -0.11,
          "time": "2021-02-19T08:18:00+07:00",
          "type": "low"
        },
        {
          "height": 0.23,
          "time": "2021-02-19T15:27:00+07:00",
          "type": "high"
        },
        {
          "height": -0.19,
          "time": "2021-02-19T22:52:00+07:00",
          "type": "low"
        }
      ],
      "pressure_data": [
        {
          "time": "2021-02-19T09:00:00+07:00",
          "pressure": 1022.13
        },
        {
          "time": "2021-02-19T10:00:00+07:00",
          "pressure": 1022.39
        },
        {
          "time": "2021-02-19T11:00:00+07:00",
          "pressure": 1021.48
        },
        {
          "time": "2021-02-19T12:00:00+07:00",
          "pressure": 1020.57
        },
        {
          "time": "2021-02-19T13:00:00+07:00",
          "pressure": 1019.66
        },
        {
          "time": "2021-02-19T14:00:00+07:00",
          "pressure": 1019.03
        },
        {
          "time": "2021-02-19T15:00:00+07:00",
          "pressure": 1018.4
        },
        {
          "time": "2021-02-19T16:00:00+07:00",
          "pressure": 1017.77
        }
      ],
      "fish_caught": NaN,
      "user_score": NaN,
      "user_notes": NaN
    },
    {
      "vietnam_date": "20/02/2021",
      "lunar_date": "09/01",
      "tidal_data": [
        {
          "height": 0.0,
          "time": "2021-02-20T05:13:00+07:00",
          "type": "high"
        },
        {
          "height": -0.04,
          "time": "2021-02-20T08:37:00+07:00",
          "type": "low"
        },
        {
          "height": 0.23,
          "time": "2021-02-20T16:00:00+07:00",
          "type": "high"
        }
      ],
      "pressure_data": [
        {
          "time": "2021-02-20T09:00:00+07:00",
          "pressure": 1020.82
        },
        {
          "time": "2021-02-20T10:00:00+07:00",
          "pressure": 1021.16
        },
        {
          "time": "2021-02-20T11:00:00+07:00",
          "pressure": 1019.87
        },
        {
          "time": "2021-02-20T12:00:00+07:00",
          "pressure": 1018.59
        },
        {
          "time": "2021-02-20T13:00:00+07:00",
          "pressure": 1017.31
        },
        {
          "time": "2021-02-20T14:00:00+07:00",
          "pressure": 1016.7
        },
        {
          "time": "2021-02-20T15:00:00+07:00",
          "pressure": 1016.09
        },
        {
          "time": "2021-02-20T16:00:00+07:00",
          "pressure": 1015.49
        }
      ],
      "fish_caught": NaN,
      "user_score": NaN,
      "user_notes": NaN
    },
    {
      "vietnam_date": "21/02/2021",
      "lunar_date": "10/01",
      "tidal_data": [
        {
          "height": -0.25,
          "time": "2021-02-21T00:02:00+07:00",
          "type": "low"
        },
        {
          "height": 0.23,
          "time": "2021-02-21T16:37:00+07:00",
          "type": "high"
        }
      ],
      "pressure_data": [
        {
          "time": "2021-02-21T09:00:00+07:00",
          "pressure": 1018.27
        },
        {
          "time": "2021-02-21T10:00:00+07:00",
          "pressure": 1018.46
        },
        {
          "time": "2021-02-21T11:00:00+07:00",
          "pressure": 1017.28
        },
        {
          "time": "2021-02-21T12:00:00+07:00",
          "pressure": 1016.11
        },
        {
          "time": "2021-02-21T13:00:00+07:00",
          "pressure": 1014.93
        },
        {
          "time": "2021-02-21T14:00:00+07:00",
          "pressure": 1014.42
        },
        {
          "time": "2021-02-21T15:00:00+07:00",
          "pressure": 1013.92
        },
        {
          "time": "2021-02-21T16:00:00+07:00",
          "pressure": 1013.41
        }
      ],
      "fish_caught": NaN,
      "user_score": NaN,
      "user_notes": NaN
    },
    {
      "vietnam_date": "22/02/2021",
      "lunar_date": "11/01",
      "tidal_data": [
        {
          "height": -0.31,
          "time": "2021-02-22T01:05:00+07:00",
          "type": "low"
        },
        {
          "height": 0.24,
          "time": "2021-02-22T17:23:00+07:00",
          "type": "high"
        }
      ],
      "pressure_data": [
        {
          "time": "2021-02-22T09:00:00+07:00",
          "pressure": 1015.85
        },
        {
          "time": "2021-02-22T10:00:00+07:00",
          "pressure": 1015.87
        },
        {
          "time": "2021-02-22T11:00:00+07:00",
          "pressure": 1015.03
        },
        {
          "time": "2021-02-22T12:00:00+07:00",
          "pressure": 1014.19
        },
        {
          "time": "2021-02-22T13:00:00+07:00",
          "pressure": 1013.35
        },
        {
          "time": "2021-02-22T14:00:00+07:00",
          "pressure": 1012.7
        },
        {
          "time": "2021-02-22T15:00:00+07:00",
          "pressure": 1012.05
        },
        {
          "time": "2021-02-22T16:00:00+07:00",
          "pressure": 1011.4
        }
      ],
      "fish_caught": NaN,
      "user_score": NaN,
      "user_notes": NaN
    },
    {
      "vietnam_date": "23/02/2021",
      "lunar_date": "12/01",
      "tidal_data": [
        {
          "height": -0.38,
          "time": "2021-02-23T01:59:00+07:00",
          "type": "low"
        },
        {
          "height": 0.26,
          "time": "2021-02-23T18:19:00+07:00",
          "type": "high"
        }
      ],
      "pressure_data": [
        {
          "time": "2021-02-23T09:00:00+07:00",
          "pressure": 1015.74
        },
        {
          "time": "2021-02-23T10:00:00+07:00",
          "pressure": 1015.87
        },
        {
          "time": "2021-02-23T11:00:00+07:00",
          "pressure": 1015.05
        },
        {
          "time": "2021-02-23T12:00:00+07:00",
          "pressure": 1014.24
        },
        {
          "time": "2021-02-23T13:00:00+07:00",
          "pressure": 1013.42
        },
        {
          "time": "2021-02-23T14:00:00+07:00",
          "pressure": 1012.8
        },
        {
          "time": "2021-02-23T15:00:00+07:00",
          "pressure": 1012.19
        },
        {
          "time": "2021-02-23T16:00:00+07:00",
          "pressure": 1011.57
        }
      ],
      "fish_caught": NaN,
      "user_score": NaN,
      "user_notes": NaN
    },
    {
      "vietnam_date": "24/02/2021",
      "lunar_date": "13/01",
      "tidal_data": [
        {
          "height": -0.43,
          "time": "2021-02-24T02:46:00+07:00",
          "type": "low"
        },
        {
          "height": 0.14,
          "time": "2021-02-24T11:06:00+07:00",
          "type": "high"
        },
        {
          "height": 0.14,
          "time": "2021-02-24T12:46:00+07:00",
          "type": "low"
        },
        {
          "height": 0.28,
          "time": "2021-02-24T19:18:00+07:00",
          "type": "high"
        }
      ],
      "pressure_data": [
        {
          "time": "2021-02-24T09:00:00+07:00",
          "pressure": 1013.95
        },
        {
          "time": "2021-02-24T10:00:00+07:00",
          "pressure": 1013.88
        },
        {
          "time": "2021-02-24T11:00:00+07:00",
          "pressure": 1012.94
        },
        {
          "time": "2021-02-24T12:00:00+07:00",
          "pressure": 1012.01
        },
        {
          "time": "2021-02-24T13:00:00+07:00",
          "pressure": 1011.07
        },
        {
          "time": "2021-02-24T14:00:00+07:00",
          "pressure": 1010.24
        },
        {
          "time": "2021-02-24T15:00:00+07:00",
          "pressure": 1009.42
        },
        {
          "time": "2021-02-24T16:00:00+07:00",
          "pressure": 1008.59
        }
      ],
      "fish_caught": NaN,
      "user_score": NaN,
      "user_notes": NaN
    },
    {
      "vietnam_date": "25/02/2021",
      "lunar_date": "14/01",
      "tidal_data": [
        {
          "height": -0.47,
          "time": "2021-02-25T03:28:00+07:00",
          "type": "low"
        },
        {
          "height": 0.16,
          "time": "2021-02-25T11:14:00+07:00",
          "type": "high"
        },
        {
          "height": 0.12,
          "time": "2021-02-25T14:12:00+07:00",
          "type": "low"
        },
        {
          "height": 0.31,
          "time": "2021-02-25T20:16:00+07:00",
          "type": "high"
        }
      ],
      "pressure_data": [
        {
          "time": "2021-02-25T09:00:00+07:00",
          "pressure": 1011.15
        },
        {
          "time": "2021-02-25T10:00:00+07:00",
          "pressure": 1011.02
        },
        {
          "time": "2021-02-25T11:00:00+07:00",
          "pressure": 1010.17
        },
        {
          "time": "2021-02-25T12:00:00+07:00",
          "pressure": 1009.32
        },
        {
          "time": "2021-02-25T13:00:00+07:00",
          "pressure": 1008.47
        },
        {
          "time": "2021-02-25T14:00:00+07:00",
          "pressure": 1007.58
        },
        {
          "time": "2021-02-25T15:00:00+07:00",
          "pressure": 1006.68
        },
        {
          "time": "2021-02-25T16:00:00+07:00",
          "pressure": 1005.79
        }
      ],
      "fish_caught": NaN,
      "user_score": NaN,
      "user_notes": NaN
    },
    {
      "vietnam_date": "26/02/2021",
      "lunar_date": "15/01",
      "tidal_data": [
        {
          "height": -0.49,
          "time": "2021-02-26T04:06:00+07:00",
          "type": "low"
        },
        {
          "height": 0.17,
          "time": "2021-02-26T11:30:00+07:00",
          "type": "high"
        },
        {
          "height": 0.09,
          "time": "2021-02-26T15:11:00+07:00",
          "type": "low"
        },
        {
          "height": 0.34,
          "time": "2021-02-26T21:12:00+07:00",
          "type": "high"
        }
      ],
      "pressure_data": [
        {
          "time": "2021-02-26T09:00:00+07:00",
          "pressure": 1009.07
        },
        {
          "time": "2021-02-26T10:00:00+07:00",
          "pressure": 1009.13
        },
        {
          "time": "2021-02-26T11:00:00+07:00",
          "pressure": 1008.3
        },
        {
          "time": "2021-02-26T12:00:00+07:00",
          "pressure": 1007.47
        },
        {
          "time": "2021-02-26T13:00:00+07:00",
          "pressure": 1006.64
        },
        {
          "time": "2021-02-26T14:00:00+07:00",
          "pressure": 1005.96
        },
        {
          "time": "2021-02-26T15:00:00+07:00",
          "pressure": 1005.28
        },
        {
          "time": "2021-02-26T16:00:00+07:00",
          "pressure": 1004.6
        }
      ],
      "fish_caught": NaN,
      "user_score": NaN,
      "user_notes": NaN
    },
    {
      "vietnam_date": "27/02/2021",
      "lunar_date": "16/01",
      "tidal_data": [
        {
          "height": -0.48,
          "time": "2021-02-27T04:44:00+07:00",
          "type": "low"
        },
        {
          "height": 0.18,
          "time": "2021-02-27T11:49:00+07:00",
          "type": "high"
        },
        {
          "height": 0.03,
          "time": "2021-02-27T16:01:00+07:00",
          "type": "low"
        },
        {
          "height": 0.36,
          "time": "2021-02-27T22:06:00+07:00",
          "type": "high"
        }
      ],
      "pressure_data": [
        {
          "time": "2021-02-27T09:00:00+07:00",
          "pressure": 1011.13
        },
        {
          "time": "2021-02-27T10:00:00+07:00",
          "pressure": 1011.4
        },
        {
          "time": "2021-02-27T11:00:00+07:00",
          "pressure": 1010.74
        },
        {
          "time": "2021-02-27T12:00:00+07:00",
          "pressure": 1010.08
        },
        {
          "time": "2021-02-27T13:00:00+07:00",
          "pressure": 1009.43
        },
        {
          "time": "2021-02-27T14:00:00+07:00",
          "pressure": 1008.85
        },
        {
          "time": "2021-02-27T15:00:00+07:00",
          "pressure": 1008.27
        },
        {
          "time": "2021-02-27T16:00:00+07:00",
          "pressure": 1007.69
        }
      ],
      "fish_caught": NaN,
      "user_score": NaN,
      "user_notes": NaN
    },
    {
      "vietnam_date": "28/02/2021",
      "lunar_date": "17/01",
      "tidal_data": [
        {
          "height": -0.46,
          "time": "2021-02-28T05:20:00+07:00",
          "type": "low"
        },
        {
          "height": 0.19,
          "time": "2021-02-28T12:09:00+07:00",
          "type": "high"
        },
        {
          "height": -0.04,
          "time": "2021-02-28T16:50:00+07:00",
          "type": "low"
        },
        {
          "height": 0.36,
          "time": "2021-02-28T23:00:00+07:00",
          "type": "high"
        }
      ],
      "pressure_data": [
        {
          "time": "2021-02-28T09:00:00+07:00",
          "pressure": 1012.82
        },
        {
          "time": "2021-02-28T10:00:00+07:00",
          "pressure": 1012.9
        },
        {
          "time": "2021-02-28T11:00:00+07:00",
          "pressure": 1012.2
        },
        {
          "time": "2021-02-28T12:00:00+07:00",
          "pressure": 1011.51
        },
        {
          "time": "2021-02-28T13:00:00+07:00",
          "pressure": 1010.81
        },
        {
          "time": "2021-02-28T14:00:00+07:00",
          "pressure": 1010.08
        },
        {
          "time": "2021-02-28T15:00:00+07:00",
          "pressure": 1009.36
        },
        {
          "time": "2021-02-28T16:00:00+07:00",
          "pressure": 1008.63
        }
      ],
      "fish_caught": NaN,
      "user_score": NaN,
      "user_notes": NaN
    },
    {
      "vietnam_date": "01/03/2021",
      "lunar_date": "18/01",
      "tidal_data": [
        {
          "height": -0.41,
          "time": "2021-03-01T05:56:00+07:00",
          "type": "low"
        },
        {
          "height": 0.21,
          "time": "2021-03-01T12:32:00+07:00",
          "type": "high"
        },
        {
          "height": -0.11,
          "time": "2021-03-01T17:41:00+07:00",
          "type": "low"
        },
        {
          "height": 0.35,
          "time": "2021-03-01T23:55:00+07:00",
          "type": "high"
        }
      ],
      "pressure_data": [
        {
          "time": "2021-03-01T09:00:00+07:00",
          "pressure": 1014.79
        },
        {
          "time": "2021-03-01T10:00:00+07:00",
          "pressure": 1015.16
        },
        {
          "time": "2021-03-01T11:00:00+07:00",
          "pressure": 1014.3
        },
        {
          "time": "2021-03-01T12:00:00+07:00",
          "pressure": 1013.44
        },
        {
          "time": "2021-03-01T13:00:00+07:00",
          "pressure": 1012.58
        },
        {
          "time": "2021-03-01T14:00:00+07:00",
          "pressure": 1012.29
        },
        {
          "time": "2021-03-01T15:00:00+07:00",
          "pressure": 1012.0
        },
        {
          "time": "2021-03-01T16:00:00+07:00",
          "pressure": 1011.7
        }
      ],
      "fish_caught": NaN,
      "user_score": NaN,
      "user_notes": NaN
    },
    {
      "vietnam_date": "02/03/2021",
      "lunar_date": "19/01",
      "tidal_data": [
        {
          "height": -0.34,
          "time": "2021-03-02T06:31:00+07:00",
          "type": "low"
        },
        {
          "height": 0.23,
          "time": "2021-03-02T12:58:00+07:00",
          "type": "high"
        },
        {
          "height": -0.18,
          "time": "2021-03-02T18:34:00+07:00",
          "type": "low"
        }
      ],
      "pressure_data": [
        {
          "time": "2021-03-02T09:00:00+07:00",
          "pressure": 1016.57
        },
        {
          "time": "2021-03-02T10:00:00+07:00",
          "pressure": 1017.22
        },
        {
          "time": "2021-03-02T11:00:00+07:00",
          "pressure": 1016.38
        },
        {
          "time": "2021-03-02T12:00:00+07:00",
          "pressure": 1015.55
        },
        {
          "time": "2021-03-02T13:00:00+07:00",
          "pressure": 1014.71
        },
        {
          "time": "2021-03-02T14:00:00+07:00",
          "pressure": 1014.45
        },
        {
          "time": "2021-03-02T15:00:00+07:00",
          "pressure": 1014.19
        },
        {
          "time": "2021-03-02T16:00:00+07:00",
          "pressure": 1013.93
        }
      ],
      "fish_caught": NaN,
      "user_score": NaN,
      "user_notes": NaN
    },
    {
      "vietnam_date": "03/03/2021",
      "lunar_date": "20/01",
      "tidal_data": [
        {
          "height": 0.31,
          "time": "2021-03-03T00:52:00+07:00",
          "type": "high"
        },
        {
          "height": -0.26,
          "time": "2021-03-03T07:06:00+07:00",
          "type": "low"
        },
        {
          "height": 0.26,
          "time": "2021-03-03T13:27:00+07:00",
          "type": "high"
        },
        {
          "height": -0.25,
          "time": "2021-03-03T19:31:00+07:00",
          "type": "low"
        }
      ],
      "pressure_data": [
        {
          "time": "2021-03-03T09:00:00+07:00",
          "pressure": 1017.56
        },
        {
          "time": "2021-03-03T10:00:00+07:00",
          "pressure": 1017.83
        },
        {
          "time": "2021-03-03T11:00:00+07:00",
          "pressure": 1016.88
        },
        {
          "time": "2021-03-03T12:00:00+07:00",
          "pressure": 1015.93
        },
        {
          "time": "2021-03-03T13:00:00+07:00",
          "pressure": 1014.98
        },
        {
          "time": "2021-03-03T14:00:00+07:00",
          "pressure": 1014.49
        },
        {
          "time": "2021-03-03T15:00:00+07:00",
          "pressure": 1013.99
        },
        {
          "time": "2021-03-03T16:00:00+07:00",
          "pressure": 1013.49
        }
      ],
      "fish_caught": NaN,
      "user_score": NaN,
      "user_notes": NaN
    },
    {
      "vietnam_date": "04/03/2021",
      "lunar_date": "21/01",
      "tidal_data": [
        {
          "height": 0.25,
          "time": "2021-03-04T01:55:00+07:00",
          "type": "high"
        },
        {
          "height": -0.17,
          "time": "2021-03-04T07:42:00+07:00",
          "type": "low"
        },
        {
          "height": 0.28,
          "time": "2021-03-04T13:59:00+07:00",
          "type": "high"
        },
        {
          "height": -0.3,
          "time": "2021-03-04T20:34:00+07:00",
          "type": "low"
        }
      ],
      "pressure_data": [
        {
          "time": "2021-03-04T09:00:00+07:00",
          "pressure": 1017.47
        },
        {
          "time": "2021-03-04T10:00:00+07:00",
          "pressure": 1017.68
        },
        {
          "time": "2021-03-04T11:00:00+07:00",
          "pressure": 1016.49
        },
        {
          "time": "2021-03-04T12:00:00+07:00",
          "pressure": 1015.29
        },
        {
          "time": "2021-03-04T13:00:00+07:00",
          "pressure": 1014.1
        },
        {
          "time": "2021-03-04T14:00:00+07:00",
          "pressure": 1013.55
        },
        {
          "time": "2021-03-04T15:00:00+07:00",
          "pressure": 1012.99
        },
        {
          "time": "2021-03-04T16:00:00+07:00",
          "pressure": 1012.43
        }
      ],
      "fish_caught": NaN,
      "user_score": NaN,
      "user_notes": NaN
    },
    {
      "vietnam_date": "05/03/2021",
      "lunar_date": "22/01",
      "tidal_data": [
        {
          "height": 0.18,
          "time": "2021-03-05T03:08:00+07:00",
          "type": "high"
        },
        {
          "height": -0.09,
          "time": "2021-03-05T08:18:00+07:00",
          "type": "low"
        },
        {
          "height": 0.3,
          "time": "2021-03-05T14:37:00+07:00",
          "type": "high"
        },
        {
          "height": -0.34,
          "time": "2021-03-05T21:45:00+07:00",
          "type": "low"
        }
      ],
      "pressure_data": [
        {
          "time": "2021-03-05T09:00:00+07:00",
          "pressure": 1015.51
        },
        {
          "time": "2021-03-05T10:00:00+07:00",
          "pressure": 1015.69
        },
        {
          "time": "2021-03-05T11:00:00+07:00",
          "pressure": 1014.48
        },
        {
          "time": "2021-03-05T12:00:00+07:00",
          "pressure": 1013.26
        },
        {
          "time": "2021-03-05T13:00:00+07:00",
          "pressure": 1012.05
        },
        {
          "time": "2021-03-05T14:00:00+07:00",
          "pressure": 1011.5
        },
        {
          "time": "2021-03-05T15:00:00+07:00",
          "pressure": 1010.96
        },
        {
          "time": "2021-03-05T16:00:00+07:00",
          "pressure": 1010.41
        }
      ],
      "fish_caught": NaN,
      "user_score": NaN,
      "user_notes": NaN
    },
    {
      "vietnam_date": "06/03/2021",
      "lunar_date": "23/01",
      "tidal_data": [
        {
          "height": 0.12,
          "time": "2021-03-06T04:38:00+07:00",
          "type": "high"
        },
        {
          "height": -0.01,
          "time": "2021-03-06T08:55:00+07:00",
          "type": "low"
        },
        {
          "height": 0.31,
          "time": "2021-03-06T15:20:00+07:00",
          "type": "high"
        },
        {
          "height": -0.38,
          "time": "2021-03-06T23:03:00+07:00",
          "type": "low"
        }
      ],
      "pressure_data": [
        {
          "time": "2021-03-06T09:00:00+07:00",
          "pressure": 1015.44
        },
        {
          "time": "2021-03-06T10:00:00+07:00",
          "pressure": 1015.59
        },
        {
          "time": "2021-03-06T11:00:00+07:00",
          "pressure": 1014.5
        },
        {
          "time": "2021-03-06T12:00:00+07:00",
          "pressure": 1013.41
        },
        {
          "time": "2021-03-06T13:00:00+07:00",
          "pressure": 1012.32
        },
        {
          "time": "2021-03-06T14:00:00+07:00",
          "pressure": 1011.81
        },
        {
          "time": "2021-03-06T15:00:00+07:00",
          "pressure": 1011.3
        },
        {
          "time": "2021-03-06T16:00:00+07:00",
          "pressure": 1010.79
        }
      ],
      "fish_caught": NaN,
      "user_score": NaN,
      "user_notes": NaN
    },
    {
      "vietnam_date": "07/03/2021",
      "lunar_date": "24/01",
      "tidal_data": [
        {
          "height": 0.1,
          "time": "2021-03-07T06:31:00+07:00",
          "type": "high"
        },
        {
          "height": 0.06,
          "time": "2021-03-07T09:38:00+07:00",
          "type": "low"
        },
        {
          "height": 0.31,
          "time": "2021-03-07T16:14:00+07:00",
          "type": "high"
        }
      ],
      "pressure_data": [
        {
          "time": "2021-03-07T09:00:00+07:00",
          "pressure": 1016.2
        },
        {
          "time": "2021-03-07T10:00:00+07:00",
          "pressure": 1016.44
        },
        {
          "time": "2021-03-07T11:00:00+07:00",
          "pressure": 1015.58
        },
        {
          "time": "2021-03-07T12:00:00+07:00",
          "pressure": 1014.73
        },
        {
          "time": "2021-03-07T13:00:00+07:00",
          "pressure": 1013.88
        },
        {
          "time": "2021-03-07T14:00:00+07:00",
          "pressure": 1013.61
        },
        {
          "time": "2021-03-07T15:00:00+07:00",
          "pressure": 1013.35
        },
        {
          "time": "2021-03-07T16:00:00+07:00",
          "pressure": 1013.08
        }
      ],
      "fish_caught": NaN,
      "user_score": NaN,
      "user_notes": NaN
    },
    {
      "vietnam_date": "08/03/2021",
      "lunar_date": "25/01",
      "tidal_data": [
        {
          "height": -0.42,
          "time": "2021-03-08T00:23:00+07:00",
          "type": "low"
        },
        {
          "height": 0.12,
          "time": "2021-03-08T08:25:00+07:00",
          "type": "high"
        },
        {
          "height": 0.11,
          "time": "2021-03-08T10:45:00+07:00",
          "type": "low"
        },
        {
          "height": 0.3,
          "time": "2021-03-08T17:19:00+07:00",
          "type": "high"
        }
      ],
      "pressure_data": [
        {
          "time": "2021-03-08T09:00:00+07:00",
          "pressure": 1018.29
        },
        {
          "time": "2021-03-08T10:00:00+07:00",
          "pressure": 1018.63
        },
        {
          "time": "2021-03-08T11:00:00+07:00",
          "pressure": 1017.43
        },
        {
          "time": "2021-03-08T12:00:00+07:00",
          "pressure": 1016.24
        },
        {
          "time": "2021-03-08T13:00:00+07:00",
          "pressure": 1015.04
        },
        {
          "time": "2021-03-08T14:00:00+07:00",
          "pressure": 1014.59
        },
        {
          "time": "2021-03-08T15:00:00+07:00",
          "pressure": 1014.15
        },
        {
          "time": "2021-03-08T16:00:00+07:00",
          "pressure": 1013.7
        }
      ],
      "fish_caught": NaN,
      "user_score": NaN,
      "user_notes": NaN
    },
    {
      "vietnam_date": "09/03/2021",
      "lunar_date": "26/01",
      "tidal_data": [
        {
          "height": -0.45,
          "time": "2021-03-09T01:36:00+07:00",
          "type": "low"
        },
        {
          "height": 0.15,
          "time": "2021-03-09T09:35:00+07:00",
          "type": "high"
        },
        {
          "height": 0.12,
          "time": "2021-03-09T12:38:00+07:00",
          "type": "low"
        },
        {
          "height": 0.3,
          "time": "2021-03-09T18:32:00+07:00",
          "type": "high"
        }
      ],
      "pressure_data": [
        {
          "time": "2021-03-09T09:00:00+07:00",
          "pressure": 1017.97
        },
        {
          "time": "2021-03-09T10:00:00+07:00",
          "pressure": 1018.26
        },
        {
          "time": "2021-03-09T11:00:00+07:00",
          "pressure": 1017.19
        },
        {
          "time": "2021-03-09T12:00:00+07:00",
          "pressure": 1016.13
        },
        {
          "time": "2021-03-09T13:00:00+07:00",
          "pressure": 1015.06
        },
        {
          "time": "2021-03-09T14:00:00+07:00",
          "pressure": 1014.58
        },
        {
          "time": "2021-03-09T15:00:00+07:00",
          "pressure": 1014.1
        },
        {
          "time": "2021-03-09T16:00:00+07:00",
          "pressure": 1013.62
        }
      ],
      "fish_caught": NaN,
      "user_score": NaN,
      "user_notes": NaN
    },
    {
      "vietnam_date": "10/03/2021",
      "lunar_date": "27/01",
      "tidal_data": [
        {
          "height": -0.47,
          "time": "2021-03-10T02:38:00+07:00",
          "type": "low"
        },
        {
          "height": 0.18,
          "time": "2021-03-10T10:15:00+07:00",
          "type": "high"
        },
        {
          "height": 0.11,
          "time": "2021-03-10T14:16:00+07:00",
          "type": "low"
        },
        {
          "height": 0.3,
          "time": "2021-03-10T19:41:00+07:00",
          "type": "high"
        }
      ],
      "pressure_data": [
        {
          "time": "2021-03-10T09:00:00+07:00",
          "pressure": 1017.71
        },
        {
          "time": "2021-03-10T10:00:00+07:00",
          "pressure": 1017.72
        },
        {
          "time": "2021-03-10T11:00:00+07:00",
          "pressure": 1016.87
        },
        {
          "time": "2021-03-10T12:00:00+07:00",
          "pressure": 1016.01
        },
        {
          "time": "2021-03-10T13:00:00+07:00",
          "pressure": 1015.16
        },
        {
          "time": "2021-03-10T14:00:00+07:00",
          "pressure": 1014.42
        },
        {
          "time": "2021-03-10T15:00:00+07:00",
          "pressure": 1013.68
        },
        {
          "time": "2021-03-10T16:00:00+07:00",
          "pressure": 1012.94
        }
      ],
      "fish_caught": NaN,
      "user_score": NaN,
      "user_notes": NaN
    },
    {
      "vietnam_date": "11/03/2021",
      "lunar_date": "28/01",
      "tidal_data": [
        {
          "height": -0.47,
